A1: PT Clipan Finance Indonesia | F1: APPLICATION STATUS MONITORING | M1: Report ID
A2: Branch : Jakarta | F2: AS OF 15 NOVEMBER 2002 | M2: Page n of m
F4: Current Status
A5: Up to Last Month Pending | C5: # of Application | D5: Rejected | E5: Batal | F5: Not yet RCA | G5: RCA but not Approved yet | H5: Approved but not yet PO | I5: Reject | J5: PO but not yet DO | K5: DO but not Go Live yet | L5: Cancel | M5: Go Live
B6: Not yet RCA | C6: 6 | F6: 1 | G6: 1 | H6: 1 | I6: 0 | J6: 1 | K6: 1 | L6: 0 | M6: 1
B7: RCA but not Approved yet | C7: 9 | G7: 1 | H7: 1 | I7: 0 | J7: 1 | K7: 1 | L7: 0 | M7: 5
B8: Approved but not yet PO | C8: 6 | H8: 1 | I8: 0 | J8: 1 | K8: 2 | L8: 0 | M8: 2
B9: PO but not yet DO | C9: 7 | J9: 1 | K9: 2 | L9: 0 | M9: 4
B10: DO but not Go Live yet | C10: 5 | K10: 2 | L10: 0 | M10: 3
A11: Total Up to Last Month Pending | C11: =SUM(C6:C10) -> 33 | F11: =SUM(F6:F10) -> 1 | G11: =SUM(G6:G10) -> 2 | H11: =SUM(H6:H10) -> 3 | I11: 0 | J11: =SUM(J6:J10) -> 4 | K11: =SUM(K6:K10) -> 8 | L11: 0 | M11: =SUM(M6:M10) -> 15
A12: Application in this Month | C12: =SUM(F12:M12) -> 32 | F12: 7 | G12: 6 | H12: 5 | I12: 0 | J12: 6 | K12: 4 | L12: 0 | M12: 4
A14: Total | C14: =C11+C12 -> 65 | F14: =F11+F12 -> 8 | G14: =G11+G12 -> 8 | H14: =H11+H12 -> 8 | I14: 0 | J14: =J11+J12 -> 10 | K14: =K11+K12 -> 12 | L14: 0 | M14: =M11+M12 -> 19
A17: Filter By :
A18: Printed By :
A19: Printed Date :