A1: COMPANY NAME | C1: AGING FOR ASSET BUY | M1: Report ID
A2: BRANCH | C2: Periode 1/1/2004 s/d 31/1/2004 | M2: Page n of m
A4: Vendor :
A5: Mutual Agreemenet No :
A6: DrawDown Percentage :
A7: Batch No :
A8: Batch Date :
A9: Currency :
A10: Prepaid Amount :
A12: Agreement No. | B12: Customer Name | C12: OS AR | D12: Days OD | E12: Amount OD | F12: OD 1-4 | G12: OD 5-15 | H12: OD 16-30 | I12: OD 31-60 | J12: OD 61-90 | K12: OD 91-120 | L12: OS Not Due | M12: AO
A13: 1 | B13: ratna | C13: 5954500 | D13: 7 | E13: 1190900 | F13: 0 | G13: 1190900 | H13: 0 | I13: 0 | J13: 0 | K13: 0 | L13: =C13-E13 -> 4763600 | M13: penny
A14: 2 | B14: richie | C14: 3964800 | D14: 0 | E14: 0 | F14: 0 | G14: 0 | H14: 0 | I14: 0 | J14: 0 | K14: 0 | L14: =C14-E14 -> 3964800 | M14: ekin
A15: 3 | B15: jackie | C15: 10398400 | D15: 0 | E15: 0 | F15: 0 | G15: 0 | H15: 0 | I15: 0 | J15: 0 | K15: 0 | L15: =C15-E15 -> 10398400 | M15: leslie
A16: 4 | B16: wallace | C16: 23072400 | D16: 10 | E16: 2563600 | F16: 0 | G16: 2563600 | H16: 0 | I16: 0 | J16: 0 | K16: 0 | L16: =C16-E16 -> 20508800 | M16: jay
A17: 5 | B17: tony | C17: 13882400 | D17: 0 | E17: 0 | F17: 0 | G17: 0 | H17: 0 | I17: 0 | J17: 0 | K17: 0 | L17: =C17-E17 -> 13882400 | M17: jolin
A18: 6 | B18: ken | C18: 42852600 | D18: 0 | E18: 0 | F18: 0 | G18: 0 | H18: 0 | I18: 0 | J18: 0 | K18: 0 | L18: =C18-E18 -> 42852600 | M18: harlem
A19: Sub Total Batch | F19: =SUM(F13:F18) -> 0 | G19: =SUM(G13:G18) -> 3754500 | H19: =SUM(H13:H18) -> 0 | I19: =SUM(I13:I18) -> 0 | J19: =SUM(J13:J18) -> 0 | K19: =SUM(K13:K18) -> 0
A21: Sub Total Mutual Agreement | F21: =F19+F16 -> 0 | G21: 3754500 | H21: =H19+H16 -> 0 | I21: =I19+I16 -> 0 | J21: =J19+J16 -> 0 | K21: =K19+K16 -> 0
A23: Sub Total Per Vendor | F23: =F21+F18 -> 0 | G23: 3754500 | H23: =H21+H18 -> 0 | I23: =I21+I18 -> 0 | J23: =J21+J18 -> 0 | K23: =K21+K18 -> 0
A25: Total Per Branch | F25: =F23+F20 -> 0 | G25: 3754500 | H25: =H23+H20 -> 0 | I25: =I23+I20 -> 0 | J25: =J23+J20 -> 0 | K25: =K23+K20 -> 0
A27: Filter By:
A28: Printed By:
A29: Printed Date: