A1: COMPANY NAME | D1: DAILY SALES FOR ASSET BUY | I1: Report ID
A2: BRANCH | D2: Periode 1/1/2004 s/d 31/1/2004 | I2: Page n of m
A4: Vendor :
A5: Mutual Agreemenet No :
A6: Draw Down Percentage :
A7: Batch No :
A8: Batch Date :
A9: Currency :
A11: Agreement No. | B11: Customer Name | C11: OTR Price | D11: Outstanding Principal | E11: NTF | F11: Installment Amount | G11: Tenor | H11: Effective Rate | I11: Asset
A12: 1 | B12: ratna | C12: 100000000 | D12: 80000000 | E12: =D12*0.8 -> 64000000 | F12: 2000000 | G12: 8 | H12: 13 | I12: opel blazer
A13: 2 | B13: richie | C13: 200000000 | D13: 80000000 | E13: =D13*0.8 -> 64000000 | F13: 4000000 | G13: 5 | H13: 12 | I13: bmw 318i
A14: 3 | B14: jackie | C14: 300000000 | D14: 80000000 | E14: =D14*0.8 -> 64000000 | F14: 5000000 | G14: 6 | H14: 11 | I14: vw new beetle
A15: 4 | B15: wallace | C15: 150000000 | D15: 80000000 | E15: =D15*0.8 -> 64000000 | F15: 3000000 | G15: 4 | H15: 10 | I15: toyota kijang
A16: 5 | B16: tony | C16: 250000000 | D16: 80000000 | E16: =D16*0.8 -> 64000000 | F16: 4000000 | G16: 6 | H16: 11 | I16: daihatsu xenia
A17: 6 | B17: ken | C17: 350000000 | D17: 80000000 | E17: =D17*0.8 -> 64000000 | F17: 5000000 | G17: 5 | H17: 12 | I17: toyota vios
A18: Sub Total per Batch b02 | C18: =SUM(C12:C17) -> 1350000000 | D18: =SUM(D12:D17) -> 480000000 | E18: =SUM(E12:E17) -> 384000000 | F18: =SUM(F12:F17) -> 23000000
A20: Sub Total Per Mutual Agreement | C20: =C18 -> 1350000000 | D20: =D18 -> 480000000 | E20: =E18 -> 384000000 | F20: =F18 -> 23000000
A22: Sub Total Per Vendor | C22: =C20 -> 1350000000 | D22: =D20 -> 480000000 | E22: =E20 -> 384000000 | F22: =F20 -> 23000000
A24: Total | C24: =C22 -> 1350000000 | D24: =D20 -> 480000000 | E24: =E20 -> 384000000 | F24: =F20 -> 23000000
A26: Filter By:
A27: Printed By:
A28: Printed Date: