A1: PT Clipan Finance Indonesia | D1: FACILITY MOVEMENT PER BATCH | H1: Program ID
D2: Date : dd/mm/yyyy | H2: Page n of m
A4: Funding Company : Bank Mandiri
B5: Facility ID | D5: : Facility-1 | E5: Contract Date | G5: : dd/mm/yyyy
B6: Plafond Amount | D6: : 99.999.999.999 | E6: Availability | G6: : from dd/mm/yyyy to dd/mm/yyyy
B7: Currency | D7: : IDR | E7: Interest Rate | G7: :
B8: Facility Type | D8: : Non Revolving | E8: Interest Type | G8: :
B9: Kind of Facility | D9: : Channeling | E9: Commitement Status | G9: : yes
B10: Security Percentage : % of Principal | E10: Availability Amount | G10: :
B12: Batch No | D12: : | E12: Provision Amount | G12: :
B13: Draw Down Date | D13: : | E13: Total Account | G13: :
B14: Draw Down Amount | D14: : | E14: Exchange Rate | G14: :
B15: Interest Rate | D15: : | E15: Tenor | G15: :
B16: Interest Type | D16: : | E16: Intsallment period | G16: : Monthly
B17: Installment Maturity Date | D17: : | E17: Installment Scheme | G17: : Fix Installment
B18: OS Loan (Balance) | D18: : | G18: :
B19: O/S A/R Customer | D19: : | E19: Security Coverage of A/R | G19: :
B20: O/S Principal Customer | D20: : | E20: Security Coverage of Principal | G20: :
B22: Month Period | C22: Repayment Date | D22: Repayment Amount | E22: Interest Paid Date | F22: Interest Paid Amount | G22: Days Accrued | H22: Accrued Amount
B23: mmmm yyyy | C23: dd/mm/yyyy | E23: dd/mm/yyyy | F23: 999999999999 | G23: 99 | H23: 999999999999
B24: mmmm yyyy | C24: dd/mm/yyyy | D24: 999999999999 | E24: dd/mm/yyyy | F24: 999999999999 | G24: 99 | H24: 999999999999
B25: mmmm yyyy | C25: dd/mm/yyyy | D25: 999999999999 | E25: dd/mm/yyyy | F25: 999999999999 | G25: 99 | H25: 999999999999
B26: mmmm yyyy | C26: dd/mm/yyyy | D26: 999999999999 | E26: dd/mm/yyyy | F26: 999999999999 | G26: 99 | H26: 999999999999
B27: mmmm yyyy | C27: dd/mm/yyyy | D27: 999999999999 | E27: dd/mm/yyyy | F27: 999999999999 | G27: 99 | H27: 999999999999
B28: mmmm yyyy | C28: dd/mm/yyyy | D28: 999999999999 | E28: dd/mm/yyyy | F28: 999999999999 | G28: 99 | H28: 999999999999
B29: mmmm yyyy | C29: dd/mm/yyyy | D29: 999999999999 | E29: dd/mm/yyyy | F29: 999999999999 | G29: 99 | H29: 999999999999
B30: mmmm yyyy | C30: dd/mm/yyyy | D30: 999999999999 | E30: dd/mm/yyyy | F30: 999999999999 | G30: 99 | H30: 999999999999
B31: mmmm yyyy | C31: dd/mm/yyyy | D31: 999999999999 | E31: dd/mm/yyyy | F31: 999999999999 | G31: 99 | H31: 999999999999
B32: mmmm yyyy | C32: dd/mm/yyyy | D32: 999999999999 | E32: dd/mm/yyyy | F32: 999999999999 | G32: 99
C33: Total | D33: =SUM(D32:D32) -> 999999999999 | F33: =SUM(F32:F32) -> 999999999999 | H33: 999999999999
B35: Batch No | D35: : | E35: Provision Amount | G35: :
B36: Draw Down Date | D36: : | E36: Total Account | G36: :
B37: Draw Down Amount | D37: : | E37: Exchange Rate | G37: :
B38: Interest Rate | D38: : | E38: Tenor | G38: :
B39: Interest Type | D39: : | E39: Intsallment period | G39: : Monthly
B40: Installment Maturity Date | D40: : | E40: Installment Scheme | G40: : Fix Installment
B41: OS Loan (Balance) | D41: : | G41: :
B42: O/S A/R Customer | D42: : | E42: Security Coverage of A/R | G42: :
B43: O/S Principal Customer | D43: : | E43: Security Coverage of Principal | G43: :
B45: Month Period | C45: Repayment Date | D45: Repayment Amount | E45: Interest Paid Date | F45: Interest Paid Amount | G45: Days Accrued | H45: Accrued Amount
B46: mmmm yyyy | C46: dd/mm/yyyy | E46: dd/mm/yyyy | F46: 999999999999 | G46: 99 | H46: 999999999999
B47: mmmm yyyy | C47: dd/mm/yyyy | D47: 999999999999 | E47: dd/mm/yyyy | F47: 999999999999 | G47: 99 | H47: 999999999999
B48: mmmm yyyy | C48: dd/mm/yyyy | D48: 999999999999 | E48: dd/mm/yyyy | F48: 999999999999 | G48: 99 | H48: 999999999999
B49: mmmm yyyy | C49: dd/mm/yyyy | D49: 999999999999 | E49: dd/mm/yyyy | F49: 999999999999 | G49: 99 | H49: 999999999999
C50: Total | D50: =D48 -> 999999999999 | F50: =F48 -> 999999999999 | H50: 999999999999
B51: Total Facility-1 | D51: =SUM(D50:D50) -> 999999999999 | F51: =SUM(F50:F50) -> 999999999999 | H51: 999999999999
A52: Total Bank Mandiri | D52: =SUM(D51:D51) -> 999999999999 | F52: =SUM(F51:F51) -> 999999999999 | H52: 999999999999
A54: Filter By | C54: Year, Bank, Facility, Batch
A55: Printed By
A56: Printed Date