A1: PT Clipan Finance Indonesia | H1: LOAN FACILITY LISTING STATUS | M1: Program ID
H2: Date : dd/mm/yyyy | M2: Page n of m
A4: Revolving
B5: Joint Financing
C6: Bank Mega
D7: Facility ID | G7: Facility-1 | I7: Amount Facility | K7: 50000000000
D8: Interest Type | G8: Floating | I8: Facility rate | K8: 0.2
D9: Security Type | G9: Corporate Guarantee | I9: Undrawn Amount | K9: =K7-H27 -> 16500000000
D10: Security Coverage | G10: 1.2 | I10: Drawn Amount | K10: =H27 -> 33500000000
D11: % Of | G11: Principal
D12: Data Fraw Down
F13: Draw Down Date | G13: Final Date | H13: Drawn Amount | I13: Rate | J13: Total Repayment | K13: Outstanding Loan | L13: Average Drawn Rate | M13: Average Facility Rate
E15: Fixed Rate
F16: 37655 | G16: 38386 | H16: 10000000000 | I16: 0.19 | J16: 6000000000 | K16: =H16-J16 -> 4000000000 | L16: =K16*I16 -> 760000000 | M16: =H16*I16 -> 1900000000
F17: 37812 | G17: 38543 | H17: 4000000000 | I17: 0.19 | J17: 2000000000 | K17: =H17-J17 -> 2000000000 | L17: =K17*I17 -> 380000000 | M17: =H17*I17 -> 760000000
F18: 37837 | G18: 38568 | H18: 2000000000 | I18: 0.18 | J18: 1300000000 | K18: =H18-J18 -> 700000000 | L18: =K18*I18 -> 126000000 | M18: =H18*I18 -> 360000000
E19: Total Fixed Rate | H19: =SUM(H16:H18) -> 16000000000 | J19: =SUM(J16:J18) -> 9300000000 | K19: =SUM(K16:K18) -> 6700000000 | L19: =SUM(L16:L18) -> 1266000000 | M19: =SUM(M16:M18) -> 3020000000
K20: AVG Rate | L20: =L19/K19 -> 0.18895522388059702
E21: Floating Rate
F22: 37624 | G22: 38386 | H22: 7000000000 | I22: 0.19 | J22: 6000000000 | K22: =H22-J22 -> 1000000000 | L22: =K22*I22 -> 190000000 | M22: =H22*I22 -> 1330000000
F23: 37661 | G23: 38386 | H23: 5000000000 | I23: 0.21 | J23: 4000000000 | K23: =H23-J23 -> 1000000000 | L23: =K23*I23 -> 210000000 | M23: =H23*I23 -> 1050000000
F24: 37714 | G24: 38445 | H24: 5500000000 | I24: 0.18 | J24: 5000000000 | K24: =H24-J24 -> 500000000 | L24: =K24*I24 -> 90000000 | M24: =H24*I24 -> 990000000
E25: Total Fixed Rate | H25: =SUM(H22:H24) -> 17500000000 | J25: =SUM(J22:J24) -> 15000000000 | K25: =SUM(K22:K24) -> 2500000000 | L25: =SUM(L22:L24) -> 490000000 | M25: =SUM(M22:M24) -> 3370000000
K26: AVG Rate | L26: =L25/K25 -> 0.19600000000000001
D27: Total Facility-1 | H27: =H19+H25 -> 33500000000 | J27: =J19+J25 -> 24300000000 | K27: =K19+K25 -> 9200000000 | L27: =L19+L25 -> 1756000000 | M27: =M19+M25 -> 6390000000
K28: AVG Rate | L28: =L27/K27 -> 0.19086956521739132 | M28: =(M27+K9*K8)/K7 -> 0.1938
D30: Facility ID | G30: Facility-2 | I30: Amount Facility | K30: 50000000000
D31: Interest Type | G31: Floating | I31: Facility rate | K31: 0.2
D32: Security Type | G32: Corporate Guarantee | I32: Undrawn Amount | K32: =K30-K33 -> 40000000000
D33: Security Coverage | G33: 1.2 | I33: Drawn Amount | K33: 10000000000
D34: % Of | G34: Principal
D35: Data Fraw Down
C37: Total Bank Mega | H37: 999999999999 | J37: 999999999999 | K37: 999999999999 | L37: 999999999999 | M37: 999999999999
B38: Total Joint Financing | H38: 999999999999 | J38: 999999999999 | K38: 999999999999 | L38: 999999999999 | M38: 999999999999
A39: Total Revolving | H39: 999999999999 | J39: 999999999999 | K39: 999999999999 | L39: 999999999999 | M39: 999999999999
A40: Total Nasional | H40: 999999999999 | J40: 999999999999 | K40: 999999999999 | L40: 999999999999 | M40: 999999999999
A43: Filter by | E43: Type, Kind, Bank, Interest type
A44: Printed by
A45: Printed Date