A1: PT. Clipan Finance Indonesia | E1: Account Officer Overdue AR | P1: ReportID: OverdueAR
A2: Branch Jakarta | E2: Period: mm/yyyy to mm/yyyy | Q2: Page N of M
B5: Bulan | C5: Total A/R | E5: % Overdue | G5: Overdue Aging
G6: 1-15% | I6: 16-30% | K6: 31-60% | M6: 61-90 | O6: >90 | Q6: Total
C7: Unit | D7: Amount | E7: Unit | F7: Amount | G7: Unit | H7: Amount | I7: Unit | J7: Amount | K7: Unit | L7: Amount | M7: Unit | N7: Amount | O7: Unit | P7: Amount | Q7: Unit | R7: Amount
A8: Name: Kastoto-K001
B9: January | C9: 150 | D9: =17000000000/1000000 -> 17000 | E9: 2.35E-2 | F9: 5.33E-2 | G9: 5 | H9: =200000000/1000000 -> 200 | I9: 2 | J9: =150000000/1000000 -> 150 | K9: 1 | L9: =50000000/1000000 -> 50 | M9: 0 | N9: 0 | O9: 0 | P9: 0 | Q9: =G9+I9+K9+M9+O9 -> 8 | R9: =+H9+J9+L9 -> 400
B10: February | C10: 157 | D10: =17700000000/1000000 -> 17700 | E10: 2.2599999999999999E-2 | F10: 5.0999999999999997E-2 | G10: 5 | H10: =200000000/1000000 -> 200 | I10: 2 | J10: =150000000/1000000 -> 150 | K10: 1 | L10: =50000000/1000000 -> 50 | M10: 0 | N10: 0 | O10: 0 | P10: 0 | Q10: =G10+I10+K10+M10+O10 -> 8 | R10: =+H10+J10+L10 -> 400
B11: Maret | C11: 168 | D11: =18900000000/1000000 -> 18900 | E11: 2.12E-2 | F11: 4.7600000000000003E-2 | G11: 5 | H11: =200000000/1000000 -> 200 | I11: 2 | J11: =150000000/1000000 -> 150 | K11: 1 | L11: =50000000/1000000 -> 50 | M11: 0 | N11: 0 | O11: 0 | P11: 0 | Q11: =G11+I11+K11+M11+O11 -> 8 | R11: =+H11+J11+L11 -> 400
B12: April | C12: 175 | D12: =19850000000/1000000 -> 19850 | E12: 2.0199999999999999E-2 | F12: 4.5699999999999998E-2 | G12: 5 | H12: =200000000/1000000 -> 200 | I12: 2 | J12: =150000000/1000000 -> 150 | K12: 1 | L12: =50000000/1000000 -> 50 | M12: 0 | N12: 0 | O12: 0 | P12: 0 | Q12: =G12+I12+K12+M12+O12 -> 8 | R12: =+H12+J12+L12 -> 400
B13: Mei | C13: 183 | D13: =20650000000/1000000 -> 20650 | E13: 1.9400000000000001E-2 | F13: 4.3700000000000003E-2 | G13: 5 | H13: =200000000/1000000 -> 200 | I13: 2 | J13: =150000000/1000000 -> 150 | K13: 1 | L13: =50000000/1000000 -> 50 | M13: 0 | N13: 0 | O13: 0 | P13: 0 | Q13: =G13+I13+K13+M13+O13 -> 8 | R13: =+H13+J13+L13 -> 400
B14: Juni | C14: 193 | D14: =20650000000/1000000 -> 20650 | E14: 1.9400000000000001E-2 | F14: 4.3700000000000003E-2 | G14: 5 | H14: =200000000/1000000 -> 200 | I14: 2 | J14: =150000000/1000000 -> 150 | K14: 1 | L14: =50000000/1000000 -> 50 | M14: 0 | N14: 0 | O14: 0 | P14: 0 | Q14: =G14+I14+K14+M14+O14 -> 8 | R14: =+H14+J14+L14 -> 400
B15: Juli | C15: 193 | D15: =21690000000/1000000 -> 21690 | E15: 1.84E-2 | F15: 4.1500000000000002E-2 | G15: 5 | H15: =200000000/1000000 -> 200 | I15: 2 | J15: =150000000/1000000 -> 150 | K15: 1 | L15: =50000000/1000000 -> 50 | M15: 0 | N15: 0 | O15: 0 | P15: 0 | Q15: =G15+I15+K15+M15+O15 -> 8 | R15: =+H15+J15+L15 -> 400
B16: Agustus | C16: 201 | D16: =22490000000/1000000 -> 22490 | E16: 1.78E-2 | F16: 3.9800000000000002E-2 | G16: 5 | H16: =200000000/1000000 -> 200 | I16: 2 | J16: =150000000/1000000 -> 150 | K16: 1 | L16: =50000000/1000000 -> 50 | M16: 0 | N16: 0 | O16: 0 | P16: 0 | Q16: =G16+I16+K16+M16+O16 -> 8 | R16: =+H16+J16+L16 -> 400
A19: Note: Amount in 1,000,000