A1: PT. Clipan Finance Indonesia | C1: CA Overdue AR | G1: ReportID:
A2: Area : Indonesia Barat | C2: Period: mm/yyyy to mm/yyyy | G2: Page N of M
C4: Overdue Aging | D4: Overdue
D5: Unit | E5: Percent | F5: Amount | G5: Percent
A6: Branch : Pecenongan
A7: CA Name: Kastoto-K001
B8: Bulan: January 2002
C9: Total A/R | D9: 150 | F9: 17000000000
C10: 1-15 | D10: 5 | E10: =D10/$D$9*100 -> 3.3333333333333335 | F10: 200000000 | G10: =F10/$F$9*100 -> 1.1764705882352942
C11: 16-30 | D11: 2 | E11: =D11/$D$9*100 -> 1.3333333333333335 | F11: 150000000 | G11: =F11/$F$9*100 -> 0.88235294117647056
C12: 31-60 | D12: 1 | E12: =D12/$D$9*100 -> 0.66666666666666674 | F12: 50000000 | G12: =F12/$F$9*100 -> 0.29411764705882354
C13: 61-90 | D13: 0 | E13: =D13/$D$9*100 -> 0.00 | G13: =F13/$F$9*100 -> 0.00
C14: >90 | D14: 0 | E14: =D14/$D$9*100 -> 0.00 | G14: =F14/$F$9*100 -> 0.00
B15: Sub Total as per January: | D15: 8 | F15: 400000000
B16: Bulan: February 2002
C17: Total A/R | D17: 157 | F17: 17700000000
C18: 1-15 | D18: 5 | F18: 200000000
C19: 16-30 | D19: 2 | F19: 150000000
C20: 31-60 | D20: 1 | F20: 50000000
C21: 61-90 | D21: 0
C22: >90 | D22: 0
B23: Sub Total as per February: | D23: 8 | F23: 400000000
B24: Bulan: March 2002
C25: Total A/R | D25: 168 | F25: 18900000000
C26: 1-15 | D26: 5 | F26: 200000000
C27: 16-30 | D27: 2 | F27: 150000000
C28: 31-60 | D28: 1 | F28: 50000000
C29: 61-90 | D29: 0
C30: >90 | D30: 0
B31: Sub Total as per March: | D31: 8 | F31: 400000000
B32: Bulan: April 2002
C33: Total A/R | D33: 175 | F33: 19850000000
C34: 1-15 | D34: 5 | F34: 200000000
C35: 16-30 | D35: 2 | F35: 150000000
C36: 31-60 | D36: 1 | F36: 50000000
C37: 61-90 | D37: 0 | F37: 0
C38: >90 | D38: 0 | F38: 0
B39: Sub Total as per April: | D39: 8 | F39: 400000000
A42: Filer by :
A43: Printed by :
A44: Printed Date :