A1: PT. Clipan Finance Indonesia | C1: CA Overdue AR | G1: ReportID:
A2: Jakarta - xxxx | C2: Period: mm/yyyy to mm/yyyy | G2: Page N of M
C4: Overdue Aging | D4: Overdue
D5: Unit | E5: Percent | F5: Amount | G5: Percent
A6: CA Name: Kastoto-K001
B7: Bulan: January 2002
C8: Total A/R | D8: 150 | F8: 17000000000
C9: 1-15 | D9: 5 | E9: =D9/$D$8*100 -> 3.3333333333333335 | F9: 200000000 | G9: =F9/$F$8*100 -> 1.1764705882352942
C10: 16-30 | D10: 2 | E10: =D10/$D$8*100 -> 1.3333333333333335 | F10: 150000000 | G10: =F10/$F$8*100 -> 0.88235294117647056
C11: 31-60 | D11: 1 | E11: =D11/$D$8*100 -> 0.66666666666666674 | F11: 50000000 | G11: =F11/$F$8*100 -> 0.29411764705882354
C12: 61-90 | D12: 0 | E12: =D12/$D$8*100 -> 0.00 | G12: =F12/$F$8*100 -> 0.00
C13: >90 | D13: 0 | E13: =D13/$D$8*100 -> 0.00 | G13: =F13/$F$8*100 -> 0.00
B14: Sub Total as per January: | D14: 8 | F14: 400000000
B15: Bulan: February 2002
C16: Total A/R | D16: 157 | F16: 17700000000
C17: 1-15 | D17: 5 | F17: 200000000
C18: 16-30 | D18: 2 | F18: 150000000
C19: 31-60 | D19: 1 | F19: 50000000
C20: 61-90 | D20: 0
C21: >90 | D21: 0
B22: Sub Total as per February: | D22: 8 | F22: 400000000
B23: Bulan: March 2002
C24: Total A/R | D24: 168 | F24: 18900000000
C25: 1-15 | D25: 5 | F25: 200000000
C26: 16-30 | D26: 2 | F26: 150000000
C27: 31-60 | D27: 1 | F27: 50000000
C28: 61-90 | D28: 0
C29: >90 | D29: 0
B30: Sub Total as per March: | D30: 8 | F30: 400000000
B31: Bulan: April 2002
C32: Total A/R | D32: 175 | F32: 19850000000
C33: 1-15 | D33: 5 | F33: 200000000
C34: 16-30 | D34: 2 | F34: 150000000
C35: 31-60 | D35: 1 | F35: 50000000
C36: 61-90 | D36: 0 | F36: 0
C37: >90 | D37: 0 | F37: 0
B38: Sub Total as per April: | D38: 8 | F38: 400000000
A41: Filer by :
A42: Printed by :
A43: Printed Date :